id_especialidad;especialidad;descripcion
1;Medicina interna;Los especialistas que la practican se encargan de diagnosticar, sin aplicar la cirugía, las enfermedades que afectan a los diferentes sistemas del cuerpo animal, tales como: digestivas, urinarias, respiratorias y cardiovasculares.
2;Urgencias veterinarias;Se trata de una especialidad de vital importancia, ya que ayuda a aquellos animales que se encuentran en estado crítico o con enfermedades poco comunes. Normalmente, estos especialistas trabajar en hospitales o cínicas veterinarias. 
3;Cirugía;Se centra en el diagnóstico y tratamiento de enfermedades quirúrgicas, como son fracturas, tumores, hernias, etc. 
4;Dermatología;Como ya sabrás, este áreas se especializa en el diagnóstico y tratamiento de enfermedades de la piel, infecciones, tumores, etc.
5;Fisioterapia;Es una especialidad muy útil para aquellos animales que han sufrido dolencias o enfermedades traumatológicas. Su principal objetivo es conseguir que los animales recuperen su movilidad. Estudia rehabilitación veterinaria con nosotros.
6;Oftalmología;Entre las mascotas son muy comunes las enfermedades oculares, por lo que conviene personal cualificado para diagnosticar y tratar sus patologías, como son las cataratas, el glaucoma o los traumatismos.
7;Oncología;Se trata de la especialización centrada en el estudio, detección y tratamiento de todo tipo de cánceres en animales.
8;Radiología;Esta especialidad se centra en el uso de imágenes médicas para el diagnóstico y tratamiento de patologías. Se suelen realizar radiografías, ultrasonidos y tomografías computarizadas.
9;Nutrición animal;Este área se dedica a la evaluación de las necesidades nutricionales de un animal en base a diferentes parámetros, como es la edad, el sexo, la condición física, patologías previas, alergias, etc.
